{
  "schema_version": 1,
  "task_id": 12327,
  "identity": {
    "name_zhcn": "梦游体验",
    "name_en": "Out of Body Experience",
    "game_variant_id": "timewalking-wotlk-cn",
    "version_scope": "TitanReforged-Wotlk-ChinaRegion 3.80.2 / 时光服",
    "faction": "both",
    "repeatability": "once"
  },
  "coverage": {
    "availability": "verified",
    "rewards": "verified",
    "guide": "partial"
  },
  "availability": {
    "quest_level": 75,
    "min_level": 73,
    "pre_any": [
      12328
    ],
    "pre_all": [],
    "parent_active": [],
    "exclusive_with": [],
    "required_reputation": null,
    "required_class": [],
    "required_race": [],
    "required_skill": [],
    "hidden_requirements": []
  },
  "rewards": {
    "reward_money_copper": 0,
    "fixed_items": [],
    "choice_items_desc_by_sell": [],
    "fixed_items_sell_total_copper": 0,
    "choice_item_max_sell_copper": 0,
    "gear_sale_max_copper": 0,
    "reputation_rewards": [],
    "no_money_from_xp": false,
    "full_xp": 10500
  },
  "guide": [
    "接取：盲眼卢娜。",
    "在卢娜的水晶球旁饮下幻境药水，见证过去的景象。",
    "交付：盲眼卢娜。"
  ],
  "fivebox": {
    "status": "not_shared"
  },
  "timing_rule_ref": null,
  "evidence": [
    {
      "evidence_id": "evidence-questie-11.34.0",
      "source_type": "questie",
      "source_ref": "Questie 11.34.0 sha256=3c31d28a9c18189f3e245cdfb5b806210612e66da91c3661757c363724957861; effective quest row task_id=12327",
      "observed_at": null,
      "version_scope": "Questie WotLK 11.34.0",
      "confidence": "verified",
      "supports_fields": [
        "identity",
        "availability",
        "guide"
      ]
    },
    {
      "evidence_id": "evidence-rewards-azerothcore",
      "source_type": "local_db",
      "source_ref": "azerothcore/azerothcore-wotlk quest_template sha256=5dc7e6c92ea6875a5fc68cf5d3e33150e86cda5819a11af0c59217b24c63a37f; item_template sha256=bd4859be01946ca1521f7896f558f665e1e1d98890757a3df30e717b62768cc6 + Questie 11.34.0 zhCN/xp/reputation",
      "observed_at": null,
      "version_scope": "WotLK 3.3.5 base DB; Questie 11.34.0",
      "confidence": "verified",
      "supports_fields": [
        "rewards"
      ]
    },
    {
      "evidence_id": "evidence-fivebox-type-mapping",
      "source_type": "user_live",
      "source_ref": "data/observations/fivebox-task-types.json#tasks.12327; legacy_type=personal_scripted_vision_confirmed",
      "observed_at": "2026-09-09",
      "version_scope": "TitanReforged-Wotlk-ChinaRegion 3.80.2 / 时光服",
      "confidence": "verified",
      "supports_fields": [
        "fivebox.status"
      ]
    },
    {
      "evidence_id": "evidence-fivebox-note-deferred-to-presentation",
      "source_type": "legacy_migration",
      "source_ref": "data/observations/fivebox-task-types.json#tasks.12327",
      "observed_at": "2026-09-09",
      "version_scope": "TitanReforged-Wotlk-ChinaRegion 3.80.2 / 时光服",
      "confidence": "verified",
      "supports_fields": [
        "presentation.note_override"
      ]
    }
  ],
  "presentation": {
    "note_override": {
      "text": "【需要单独修正优化】《梦游体验》灰熊丘陵首组实跑确认：不共享；五个角色分别在卢娜水晶球附近喝药并完成视觉事件。\n《卢娜的要求》不共享，五号分别收集4份薄纱之尘。《梦游体验》不共享，五号分别在卢娜水晶球旁喝药并看完整视觉事件；若效果不自动结束，再取消buff。",
      "scope": "all",
      "source_ref": "data/observations/fivebox-task-types.json#tasks.12327 + docs/archive/generated/route-atlas/workbench-routes.json",
      "reason": "无损迁移：旧正式workbench存在多条/多任务共用备注；先逐字保全到Task Presentation，后续前端专项审计再精简，不在当前数据迁移阶段丢信息。"
    }
  }
}
