{
  "schema_version": 1,
  "task_id": 12526,
  "identity": {
    "name_zhcn": "狩猎犀牛：乘胜追击",
    "name_en": "Rhino Mastery: The Chase",
    "game_variant_id": "timewalking-wotlk-cn",
    "version_scope": "TitanReforged-Wotlk-ChinaRegion 3.80.2 / 时光服",
    "faction": "both",
    "repeatability": "once"
  },
  "coverage": {
    "availability": "verified",
    "rewards": "verified",
    "guide": "partial"
  },
  "availability": {
    "quest_level": 76,
    "min_level": 76,
    "pre_any": [
      12520
    ],
    "pre_all": [],
    "parent_active": [],
    "exclusive_with": [],
    "required_reputation": null,
    "required_class": [],
    "required_race": [],
    "required_skill": [],
    "hidden_requirements": []
  },
  "rewards": {
    "reward_money_copper": 0,
    "fixed_items": [],
    "choice_items_desc_by_sell": [],
    "fixed_items_sell_total_copper": 0,
    "choice_item_max_sell_copper": 0,
    "gear_sale_max_copper": 0,
    "reputation_rewards": [],
    "no_money_from_xp": false,
    "full_xp": 2100
  },
  "guide": [
    "接取：赫米特·奈辛瓦里。",
    "与诺兹隆之骨的神谕者索乌拉姆谈一谈。",
    "交付：神谕者索乌拉姆。"
  ],
  "fivebox": {
    "status": "pending"
  },
  "timing_rule_ref": null,
  "evidence": [
    {
      "evidence_id": "evidence-questie-11.34.0",
      "source_type": "questie",
      "source_ref": "Questie 11.34.0 sha256=3c31d28a9c18189f3e245cdfb5b806210612e66da91c3661757c363724957861; effective quest row task_id=12526",
      "observed_at": null,
      "version_scope": "Questie WotLK 11.34.0",
      "confidence": "verified",
      "supports_fields": [
        "identity",
        "availability",
        "guide"
      ]
    },
    {
      "evidence_id": "evidence-rewards-azerothcore",
      "source_type": "local_db",
      "source_ref": "azerothcore/azerothcore-wotlk quest_template sha256=5dc7e6c92ea6875a5fc68cf5d3e33150e86cda5819a11af0c59217b24c63a37f; item_template sha256=bd4859be01946ca1521f7896f558f665e1e1d98890757a3df30e717b62768cc6 + Questie 11.34.0 zhCN/xp/reputation",
      "observed_at": null,
      "version_scope": "WotLK 3.3.5 base DB; Questie 11.34.0",
      "confidence": "verified",
      "supports_fields": [
        "rewards"
      ]
    }
  ],
  "presentation": {
    "note_override": {
      "text": "",
      "scope": "all",
      "source_ref": "docs/archive/generated/route-atlas/workbench-routes.json",
      "reason": "机械迁移确认当前正式workbench没有可归属到该任务的独立备注；显式保持为空。"
    }
  }
}
