{
  "schema_version": 1,
  "task_id": 12668,
  "identity": {
    "name_zhcn": "复仇的基础",
    "name_en": "Foundation for Revenge",
    "game_variant_id": "timewalking-wotlk-cn",
    "version_scope": "TitanReforged-Wotlk-ChinaRegion 3.80.2 / 时光服",
    "faction": "both",
    "repeatability": "once"
  },
  "coverage": {
    "availability": "verified",
    "rewards": "verified",
    "guide": "partial"
  },
  "availability": {
    "quest_level": 77,
    "min_level": 74,
    "pre_any": [
      12672
    ],
    "pre_all": [],
    "parent_active": [],
    "exclusive_with": [],
    "required_reputation": null,
    "required_class": [],
    "required_race": [],
    "required_skill": [],
    "hidden_requirements": []
  },
  "rewards": {
    "reward_money_copper": 0,
    "fixed_items": [],
    "choice_items_desc_by_sell": [],
    "fixed_items_sell_total_copper": 0,
    "choice_item_max_sell_copper": 0,
    "gear_sale_max_copper": 0,
    "reputation_rewards": [],
    "no_money_from_xp": false,
    "full_xp": 21400
  },
  "guide": [
    "接取：奎丝鲁恩之魂。",
    "奎丝鲁恩之魂要你在她的灵魂之泉附近杀死12个巨魔，奎丝鲁恩崇拜者或蛇灵狂暴者都可以。 /  / 完成任务之后回到奎丝鲁恩祭坛向她复命。",
    "交付：奎丝鲁恩之魂。"
  ],
  "fivebox": {
    "status": "shared"
  },
  "timing_rule_ref": null,
  "evidence": [
    {
      "evidence_id": "evidence-questie-11.34.0",
      "source_type": "questie",
      "source_ref": "Questie 11.34.0 sha256=3c31d28a9c18189f3e245cdfb5b806210612e66da91c3661757c363724957861; effective quest row task_id=12668",
      "observed_at": null,
      "version_scope": "Questie WotLK 11.34.0",
      "confidence": "verified",
      "supports_fields": [
        "identity",
        "availability",
        "guide"
      ]
    },
    {
      "evidence_id": "evidence-rewards-azerothcore",
      "source_type": "local_db",
      "source_ref": "azerothcore/azerothcore-wotlk quest_template sha256=5dc7e6c92ea6875a5fc68cf5d3e33150e86cda5819a11af0c59217b24c63a37f; item_template sha256=bd4859be01946ca1521f7896f558f665e1e1d98890757a3df30e717b62768cc6 + Questie 11.34.0 zhCN/xp/reputation",
      "observed_at": null,
      "version_scope": "WotLK 3.3.5 base DB; Questie 11.34.0",
      "confidence": "verified",
      "supports_fields": [
        "rewards"
      ]
    },
    {
      "evidence_id": "evidence-fivebox-type-mapping",
      "source_type": "user_live",
      "source_ref": "data/observations/fivebox-task-types.json#tasks.12668; legacy_type=quest_progress_group_shared_confirmed",
      "observed_at": "2026-09-07",
      "version_scope": "TitanReforged-Wotlk-ChinaRegion 3.80.2 / 时光服",
      "confidence": "verified",
      "supports_fields": [
        "fivebox.status"
      ]
    },
    {
      "evidence_id": "evidence-fivebox-note-deferred-to-presentation",
      "source_type": "legacy_migration",
      "source_ref": "data/observations/fivebox-task-types.json#tasks.12668",
      "observed_at": "2026-09-07",
      "version_scope": "TitanReforged-Wotlk-ChinaRegion 3.80.2 / 时光服",
      "confidence": "verified",
      "supports_fields": [
        "presentation.note_override"
      ]
    }
  ],
  "presentation": {
    "note_override": {
      "text": "《复仇的基础》：共享：把奎丝鲁恩崇拜者或蛇灵狂暴者拉到灵魂之泉旁边再击杀；离泉太远不计数，先看一次进度跳字再继续。\n【需要单独修正优化】《复仇的基础》2026-09-06至07祖达克首组实跑：共享：把奎丝鲁恩崇拜者或蛇灵狂暴者拉到灵魂之泉旁边再击杀；离泉太远不计数，先看一次进度跳字再继续。",
      "scope": "all",
      "source_ref": "docs/archive/generated/route-atlas/workbench-routes.json + data/observations/fivebox-task-types.json#tasks.12668",
      "reason": "无损迁移：旧fivebox备注暂不做Presentation优化；仅该段以【需要单独修正优化】标记，后续专项搜索处理。"
    }
  }
}
