{
  "schema_version": 1,
  "task_id": 10389,
  "identity": {
    "name_zhcn": "痛苦与黑暗",
    "name_en": "The Agony and the Darkness",
    "game_variant_id": "timewalking-wotlk-cn",
    "version_scope": "TitanReforged-Wotlk-ChinaRegion 3.80.2 / 时光服",
    "faction": "horde",
    "repeatability": "once"
  },
  "coverage": {
    "availability": "verified",
    "rewards": "verified",
    "guide": "partial"
  },
  "availability": {
    "quest_level": 61,
    "min_level": 58,
    "pre_any": [
      10392,
      10393
    ],
    "pre_all": [],
    "parent_active": [],
    "exclusive_with": [],
    "required_reputation": null,
    "required_class": [],
    "required_race": [
      "orc",
      "undead",
      "tauren",
      "troll",
      "blood_elf"
    ],
    "required_skill": [],
    "hidden_requirements": []
  },
  "rewards": {
    "reward_money_copper": 20000,
    "fixed_items": [],
    "choice_items_desc_by_sell": [],
    "fixed_items_sell_total_copper": 0,
    "choice_item_max_sell_copper": 0,
    "gear_sale_max_copper": 0,
    "reputation_rewards": [
      {
        "faction_id": 947,
        "amount": 250
      }
    ],
    "no_money_from_xp": false,
    "full_xp": 9800
  },
  "guide": [
    "接取：魔导师文森特·血鹰。",
    "在阿苟纳之池击杀10个恐惧魔；本轮实测五号共享进度。",
    "交付：魔导师文森特·血鹰。"
  ],
  "fivebox": {
    "status": "shared"
  },
  "timing_rule_ref": "shared-kill-count",
  "evidence": [
    {
      "evidence_id": "evidence-user-live-2026-09-17",
      "source_type": "user_live",
      "source_ref": "user live-run report 2026-09-17",
      "observed_at": "2026-09-17",
      "version_scope": "TitanReforged-Wotlk-ChinaRegion 3.80.2 / 时光服",
      "confidence": "verified",
      "supports_fields": [
        "guide",
        "fivebox.status"
      ]
    },
    {
      "evidence_id": "evidence-foundation-migration",
      "source_type": "legacy_migration",
      "source_ref": "data/routes/world-candidate-dk/3483-hellfire-peninsula/route.json#quest_id=10389",
      "observed_at": null,
      "version_scope": "current migrated project data",
      "confidence": "partial",
      "supports_fields": [
        "identity.name_zhcn",
        "identity.name_en",
        "availability.quest_level",
        "availability.min_level",
        "availability.pre_any",
        "availability.pre_all"
      ]
    },
    {
      "evidence_id": "evidence-questie-11.34.0",
      "source_type": "questie",
      "source_ref": "Questie 11.34.0 sha256=3c31d28a9c18189f3e245cdfb5b806210612e66da91c3661757c363724957861; effective quest row task_id=10389",
      "observed_at": null,
      "version_scope": "Questie WotLK 11.34.0",
      "confidence": "verified",
      "supports_fields": [
        "identity",
        "availability",
        "guide"
      ]
    },
    {
      "evidence_id": "evidence-rewards-azerothcore",
      "source_type": "local_db",
      "source_ref": "azerothcore/azerothcore-wotlk quest_template sha256=5dc7e6c92ea6875a5fc68cf5d3e33150e86cda5819a11af0c59217b24c63a37f; item_template sha256=bd4859be01946ca1521f7896f558f665e1e1d98890757a3df30e717b62768cc6 + Questie 11.34.0 zhCN/xp/reputation",
      "observed_at": null,
      "version_scope": "WotLK 3.3.5 base DB; Questie 11.34.0",
      "confidence": "verified",
      "supports_fields": [
        "rewards"
      ]
    }
  ],
  "presentation": {
    "note_override": {
      "text": "",
      "scope": "all",
      "source_ref": "docs/archive/generated/route-atlas/workbench-routes.json",
      "reason": "机械迁移确认当前正式workbench没有可归属到该任务的独立备注；显式保持为空。"
    }
  }
}
