{
  "schema_version": 1,
  "task_id": 13163,
  "identity": {
    "name_zhcn": "鲜血骑士",
    "name_en": "The Rider of Blood",
    "game_variant_id": "timewalking-wotlk-cn",
    "version_scope": "TitanReforged-Wotlk-ChinaRegion 3.80.2 / 时光服",
    "faction": "both",
    "repeatability": "once"
  },
  "coverage": {
    "availability": "verified",
    "rewards": "verified",
    "guide": "partial"
  },
  "availability": {
    "quest_level": 80,
    "min_level": 77,
    "pre_any": [
      13160
    ],
    "pre_all": [],
    "parent_active": [],
    "exclusive_with": [],
    "required_reputation": null,
    "required_class": [],
    "required_race": [],
    "required_skill": [],
    "hidden_requirements": []
  },
  "rewards": {
    "reward_money_copper": 148000,
    "fixed_items": [],
    "choice_items_desc_by_sell": [
      {
        "item_id": 43939,
        "quantity": 1,
        "name_zhcn": "溅血胸铠",
        "name_en": "Breastplate of Splattered Blood",
        "sell_price_each_copper": 71640,
        "sell_price_total_copper": 71640
      },
      {
        "item_id": 43896,
        "quantity": 1,
        "name_zhcn": "怪异屠夫的短裤",
        "name_en": "Grotesque Butcher's Pants",
        "sell_price_each_copper": 55971,
        "sell_price_total_copper": 55971
      },
      {
        "item_id": 43937,
        "quantity": 1,
        "name_zhcn": "猎血者的罩帽",
        "name_en": "Blood-stalker's Cover",
        "sell_price_each_copper": 50538,
        "sell_price_total_copper": 50538
      },
      {
        "item_id": 43877,
        "quantity": 1,
        "name_zhcn": "血铸之环",
        "name_en": "Blood-forged Circle",
        "sell_price_each_copper": 39056,
        "sell_price_total_copper": 39056
      }
    ],
    "fixed_items_sell_total_copper": 0,
    "choice_item_max_sell_copper": 71640,
    "gear_sale_max_copper": 71640,
    "reputation_rewards": [
      {
        "faction_id": 1098,
        "amount": 350
      }
    ],
    "no_money_from_xp": false,
    "full_xp": 27550
  },
  "guide": [
    "接取：狡诈者维雷斯。",
    "苦难高地的狡诈者维雷斯要你杀死贝洛克，鲜血骑士。",
    "交付：狡诈者维雷斯。"
  ],
  "fivebox": {
    "status": "shared"
  },
  "timing_rule_ref": "fixed-service-seconds",
  "evidence": [
    {
      "evidence_id": "evidence-questie-11.34.0",
      "source_type": "questie",
      "source_ref": "Questie 11.34.0 sha256=3c31d28a9c18189f3e245cdfb5b806210612e66da91c3661757c363724957861; effective quest row task_id=13163",
      "observed_at": null,
      "version_scope": "Questie WotLK 11.34.0",
      "confidence": "verified",
      "supports_fields": [
        "identity",
        "availability",
        "guide"
      ]
    },
    {
      "evidence_id": "evidence-rewards-azerothcore",
      "source_type": "local_db",
      "source_ref": "azerothcore/azerothcore-wotlk quest_template sha256=5dc7e6c92ea6875a5fc68cf5d3e33150e86cda5819a11af0c59217b24c63a37f; item_template sha256=bd4859be01946ca1521f7896f558f665e1e1d98890757a3df30e717b62768cc6 + Questie 11.34.0 zhCN/xp/reputation",
      "observed_at": null,
      "version_scope": "WotLK 3.3.5 base DB; Questie 11.34.0",
      "confidence": "verified",
      "supports_fields": [
        "rewards"
      ]
    },
    {
      "evidence_id": "evidence-derived-fivebox-baseline-2026-09-26",
      "source_type": "derived",
      "source_ref": "docs/rules/execution-and-mechanics.md §4 baseline; Questie objective is ordinary kill credit only and Task Card guide/note contains no task-item/use/event/vehicle/escort/summon/dialogue-trigger/personal stage.",
      "observed_at": "2026-09-26",
      "version_scope": "TitanReforged-Wotlk-ChinaRegion 3.80.2 / 时光服",
      "confidence": "verified",
      "supports_fields": [
        "fivebox"
      ]
    }
  ],
  "presentation": {
    "note_override": {
      "text": "",
      "scope": "all",
      "source_ref": "docs/archive/generated/route-atlas/workbench-routes.json",
      "reason": "机械迁移确认当前正式workbench没有可归属到该任务的独立备注；显式保持为空。"
    }
  }
}
