{
  "schema_version": 1,
  "task_id": 12557,
  "identity": {
    "name_zhcn": "实验室的学徒",
    "name_en": "Lab Work",
    "game_variant_id": "timewalking-wotlk-cn",
    "version_scope": "TitanReforged-Wotlk-ChinaRegion 3.80.2 / 时光服",
    "faction": "both",
    "repeatability": "once"
  },
  "coverage": {
    "availability": "verified",
    "rewards": "verified",
    "guide": "partial"
  },
  "availability": {
    "quest_level": 76,
    "min_level": 74,
    "pre_any": [],
    "pre_all": [],
    "parent_active": [
      12596
    ],
    "exclusive_with": [],
    "required_reputation": null,
    "required_class": [],
    "required_race": [],
    "required_skill": [],
    "hidden_requirements": []
  },
  "rewards": {
    "reward_money_copper": 6200,
    "fixed_items": [],
    "choice_items_desc_by_sell": [],
    "fixed_items_sell_total_copper": 0,
    "choice_item_max_sell_copper": 0,
    "gear_sale_max_copper": 0,
    "reputation_rewards": [],
    "no_money_from_xp": false,
    "full_xp": 2100
  },
  "guide": [
    "接取：炼金师菲肯斯坦。",
    "赫布瓦罗的炼金师菲肯斯坦要求你在他的实验室内找到一只泥潭蛆虫、一片干瘪的蝙蝠翼、一粒琥珀种子和一些冰冷的毒蛇粘液。",
    "交付：炼金师菲肯斯坦。"
  ],
  "fivebox": {
    "status": "not_shared"
  },
  "timing_rule_ref": null,
  "evidence": [
    {
      "evidence_id": "evidence-questie-11.34.0",
      "source_type": "questie",
      "source_ref": "Questie 11.34.0 sha256=3c31d28a9c18189f3e245cdfb5b806210612e66da91c3661757c363724957861; effective quest row task_id=12557",
      "observed_at": null,
      "version_scope": "Questie WotLK 11.34.0",
      "confidence": "verified",
      "supports_fields": [
        "identity",
        "availability",
        "guide"
      ]
    },
    {
      "evidence_id": "evidence-rewards-azerothcore",
      "source_type": "local_db",
      "source_ref": "azerothcore/azerothcore-wotlk quest_template sha256=5dc7e6c92ea6875a5fc68cf5d3e33150e86cda5819a11af0c59217b24c63a37f; item_template sha256=bd4859be01946ca1521f7896f558f665e1e1d98890757a3df30e717b62768cc6 + Questie 11.34.0 zhCN/xp/reputation",
      "observed_at": null,
      "version_scope": "WotLK 3.3.5 base DB; Questie 11.34.0",
      "confidence": "verified",
      "supports_fields": [
        "rewards"
      ]
    },
    {
      "evidence_id": "evidence-fivebox-type-mapping",
      "source_type": "user_live",
      "source_ref": "data/observations/fivebox-task-types.json#tasks.12557; legacy_type=fixed_object_collect_personal_confirmed",
      "observed_at": null,
      "version_scope": "TitanReforged-Wotlk-ChinaRegion 3.80.2 / 时光服",
      "confidence": "verified",
      "supports_fields": [
        "fivebox.status"
      ]
    },
    {
      "evidence_id": "evidence-fivebox-note-deferred-to-presentation",
      "source_type": "legacy_migration",
      "source_ref": "data/observations/fivebox-task-types.json#tasks.12557",
      "observed_at": null,
      "version_scope": "TitanReforged-Wotlk-ChinaRegion 3.80.2 / 时光服",
      "confidence": "verified",
      "supports_fields": [
        "presentation.note_override"
      ]
    }
  ],
  "presentation": {
    "note_override": {
      "text": "4种材料都在实验室内固定位置。",
      "scope": "all",
      "source_ref": "2026-09-26 Route Atlas note audit",
      "reason": "逐任务Presentation审计：删除迁移标记、实跑过程和重复状态，只保留当前任务执行必要信息。"
    }
  }
}
