{
  "schema_version": 1,
  "task_id": 11660,
  "identity": {
    "name_zhcn": "古代水手的号角",
    "name_en": "Horn of the Ancient Mariner",
    "game_variant_id": "timewalking-wotlk-cn",
    "version_scope": "TitanReforged-Wotlk-ChinaRegion 3.80.2 / 时光服",
    "faction": "horde",
    "repeatability": "once"
  },
  "coverage": {
    "availability": "verified",
    "rewards": "verified",
    "guide": "partial"
  },
  "availability": {
    "quest_level": 71,
    "min_level": 68,
    "pre_any": [],
    "pre_all": [],
    "parent_active": [],
    "exclusive_with": [],
    "required_reputation": null,
    "required_class": [],
    "required_race": [
      "orc",
      "undead",
      "tauren",
      "troll",
      "blood_elf"
    ],
    "required_skill": [],
    "hidden_requirements": []
  },
  "rewards": {
    "reward_money_copper": 0,
    "fixed_items": [],
    "choice_items_desc_by_sell": [],
    "fixed_items_sell_total_copper": 0,
    "choice_item_max_sell_copper": 0,
    "gear_sale_max_copper": 0,
    "reputation_rewards": [
      {
        "faction_id": 1073,
        "amount": 250
      }
    ],
    "no_money_from_xp": false,
    "full_xp": 20100
  },
  "guide": [
    "接取：瓦托尔。",
    "北风苔原回音海岸的瓦托尔要你夺得古代水手的号角。",
    "交付：瓦托尔。",
    "古代水手的号角可由五个角色对同一掉落来源依次拾取。"
  ],
  "fivebox": {
    "status": "sequential_loot"
  },
  "timing_rule_ref": "fixed-service-seconds",
  "evidence": [
    {
      "evidence_id": "evidence-user-live-2026-09-20-21",
      "source_type": "user_live",
      "source_ref": "user live-run report 2026-09-20 to 2026-09-21; Questie Journey used for event order",
      "observed_at": "2026-09-21",
      "version_scope": "TitanReforged-Wotlk-ChinaRegion 3.80.2 / 时光服",
      "confidence": "verified",
      "supports_fields": [
        "fivebox.status",
        "guide",
        "presentation.note_override"
      ]
    },
    {
      "evidence_id": "evidence-questie-11.34.0",
      "source_type": "questie",
      "source_ref": "Questie 11.34.0 sha256=3c31d28a9c18189f3e245cdfb5b806210612e66da91c3661757c363724957861; effective quest row task_id=11660",
      "observed_at": null,
      "version_scope": "Questie WotLK 11.34.0",
      "confidence": "verified",
      "supports_fields": [
        "identity",
        "availability",
        "guide"
      ]
    },
    {
      "evidence_id": "evidence-rewards-azerothcore",
      "source_type": "local_db",
      "source_ref": "azerothcore/azerothcore-wotlk quest_template sha256=5dc7e6c92ea6875a5fc68cf5d3e33150e86cda5819a11af0c59217b24c63a37f; item_template sha256=bd4859be01946ca1521f7896f558f665e1e1d98890757a3df30e717b62768cc6 + Questie 11.34.0 zhCN/xp/reputation",
      "observed_at": null,
      "version_scope": "WotLK 3.3.5 base DB; Questie 11.34.0",
      "confidence": "verified",
      "supports_fields": [
        "rewards"
      ]
    }
  ],
  "presentation": {
    "note_override": {
      "text": "古代水手的号角可由五个角色对同一掉落来源依次拾取。",
      "scope": "route_profile:borean-fivebox",
      "source_ref": "user live-run report 2026-09-20 to 2026-09-21",
      "reason": "北风苔原五开实跑确认的共享/拾取/执行机制；保留仍有价值的旧位置提示。"
    }
  }
}
