{
  "schema_version": 1,
  "task_id": 11268,
  "identity": {
    "name_zhcn": "行尸走肉",
    "name_en": "The Walking Dead",
    "game_variant_id": "timewalking-wotlk-cn",
    "version_scope": "TitanReforged-Wotlk-ChinaRegion 3.80.2 / 时光服",
    "faction": "horde",
    "repeatability": "once"
  },
  "coverage": {
    "availability": "verified",
    "rewards": "verified",
    "guide": "partial"
  },
  "availability": {
    "quest_level": 71,
    "min_level": 68,
    "pre_any": [
      11265
    ],
    "pre_all": [],
    "parent_active": [],
    "exclusive_with": [],
    "required_reputation": null,
    "required_class": [],
    "required_race": [
      "orc",
      "undead",
      "tauren",
      "troll",
      "blood_elf"
    ],
    "required_skill": [],
    "hidden_requirements": []
  },
  "rewards": {
    "reward_money_copper": 47000,
    "fixed_items": [],
    "choice_items_desc_by_sell": [
      {
        "item_id": 35887,
        "quantity": 1,
        "name_zhcn": "泥污胫甲",
        "name_en": "Loam-Stained Greaves",
        "sell_price_each_copper": 47209,
        "sell_price_total_copper": 47209
      },
      {
        "item_id": 35885,
        "quantity": 1,
        "name_zhcn": "部族护胸",
        "name_en": "Tribal Chestguard",
        "sell_price_each_copper": 44730,
        "sell_price_total_copper": 44730
      },
      {
        "item_id": 35884,
        "quantity": 1,
        "name_zhcn": "帝王长裤",
        "name_en": "Regal Pantaloons",
        "sell_price_each_copper": 35656,
        "sell_price_total_copper": 35656
      },
      {
        "item_id": 35886,
        "quantity": 1,
        "name_zhcn": "座狼利齿坠饰",
        "name_en": "Worgtooth Pendant",
        "sell_price_each_copper": 31478,
        "sell_price_total_copper": 31478
      }
    ],
    "fixed_items_sell_total_copper": 0,
    "choice_item_max_sell_copper": 47209,
    "gear_sale_max_copper": 47209,
    "reputation_rewards": [
      {
        "faction_id": 1064,
        "amount": 250
      }
    ],
    "no_money_from_xp": false,
    "full_xp": 20100
  },
  "guide": [
    "接取：安卡祖母。",
    "消灭10个不死的看守者、4个可怕的丧尸和2个腐烂的畸形妖，然后返回冬蹄营地向安卡祖母复命。",
    "交付：安卡祖母。"
  ],
  "fivebox": {
    "status": "shared"
  },
  "timing_rule_ref": "shared-kill-count",
  "evidence": [
    {
      "evidence_id": "evidence-questie-11.34.0",
      "source_type": "questie",
      "source_ref": "Questie 11.34.0 sha256=3c31d28a9c18189f3e245cdfb5b806210612e66da91c3661757c363724957861; effective quest row task_id=11268",
      "observed_at": null,
      "version_scope": "Questie WotLK 11.34.0",
      "confidence": "verified",
      "supports_fields": [
        "identity",
        "availability",
        "guide"
      ]
    },
    {
      "evidence_id": "evidence-rewards-azerothcore",
      "source_type": "local_db",
      "source_ref": "azerothcore/azerothcore-wotlk quest_template sha256=5dc7e6c92ea6875a5fc68cf5d3e33150e86cda5819a11af0c59217b24c63a37f; item_template sha256=bd4859be01946ca1521f7896f558f665e1e1d98890757a3df30e717b62768cc6 + Questie 11.34.0 zhCN/xp/reputation",
      "observed_at": null,
      "version_scope": "WotLK 3.3.5 base DB; Questie 11.34.0",
      "confidence": "verified",
      "supports_fields": [
        "rewards"
      ]
    },
    {
      "evidence_id": "evidence-derived-fivebox-baseline-2026-09-26",
      "source_type": "derived",
      "source_ref": "docs/rules/execution-and-mechanics.md §4 baseline; Questie objective is ordinary kill credit only and Task Card guide/note contains no task-item/use/event/vehicle/escort/summon/dialogue-trigger/personal stage.",
      "observed_at": "2026-09-26",
      "version_scope": "TitanReforged-Wotlk-ChinaRegion 3.80.2 / 时光服",
      "confidence": "verified",
      "supports_fields": [
        "fivebox"
      ]
    }
  ],
  "presentation": {
    "note_override": {
      "text": "",
      "scope": "all",
      "source_ref": "docs/archive/generated/route-atlas/workbench-routes.json",
      "reason": "机械迁移确认当前正式workbench没有可归属到该任务的独立备注；显式保持为空。"
    }
  }
}
