{
  "schema_version": 1,
  "task_id": 12589,
  "identity": {
    "name_zhcn": "后坐力？什么后坐力？",
    "name_en": "Kick, What Kick?",
    "game_variant_id": "timewalking-wotlk-cn",
    "version_scope": "TitanReforged-Wotlk-ChinaRegion 3.80.2 / 时光服",
    "faction": "both",
    "repeatability": "once"
  },
  "coverage": {
    "availability": "verified",
    "rewards": "verified",
    "guide": "partial"
  },
  "availability": {
    "quest_level": 76,
    "min_level": 76,
    "pre_any": [],
    "pre_all": [
      12523,
      12525
    ],
    "parent_active": [],
    "exclusive_with": [],
    "required_reputation": null,
    "required_class": [],
    "required_race": [],
    "required_skill": [],
    "hidden_requirements": []
  },
  "rewards": {
    "reward_money_copper": 0,
    "fixed_items": [],
    "choice_items_desc_by_sell": [],
    "fixed_items_sell_total_copper": 0,
    "choice_item_max_sell_copper": 0,
    "gear_sale_max_copper": 0,
    "reputation_rewards": [],
    "no_money_from_xp": false,
    "full_xp": 2100
  },
  "guide": [
    "接取：德洛斯坦。",
    "使用RJR步枪击中幸运的威尔海姆头顶的苹果，然后与德洛斯坦谈一谈。",
    "交付：德洛斯坦。"
  ],
  "fivebox": {
    "status": "shared"
  },
  "timing_rule_ref": "fixed-service-seconds",
  "evidence": [
    {
      "evidence_id": "evidence-questie-11.34.0",
      "source_type": "questie",
      "source_ref": "Questie 11.34.0 sha256=3c31d28a9c18189f3e245cdfb5b806210612e66da91c3661757c363724957861; effective quest row task_id=12589",
      "observed_at": null,
      "version_scope": "Questie WotLK 11.34.0",
      "confidence": "verified",
      "supports_fields": [
        "identity",
        "availability",
        "guide"
      ]
    },
    {
      "evidence_id": "evidence-rewards-azerothcore",
      "source_type": "local_db",
      "source_ref": "azerothcore/azerothcore-wotlk quest_template sha256=5dc7e6c92ea6875a5fc68cf5d3e33150e86cda5819a11af0c59217b24c63a37f; item_template sha256=bd4859be01946ca1521f7896f558f665e1e1d98890757a3df30e717b62768cc6 + Questie 11.34.0 zhCN/xp/reputation",
      "observed_at": null,
      "version_scope": "WotLK 3.3.5 base DB; Questie 11.34.0",
      "confidence": "verified",
      "supports_fields": [
        "rewards"
      ]
    },
    {
      "evidence_id": "evidence-fivebox-type-mapping",
      "source_type": "user_live",
      "source_ref": "data/observations/fivebox-task-types.json#tasks.12589; legacy_type=quest_use_group_shared_confirmed",
      "observed_at": null,
      "version_scope": "TitanReforged-Wotlk-ChinaRegion 3.80.2 / 时光服",
      "confidence": "verified",
      "supports_fields": [
        "fivebox.status"
      ]
    }
  ],
  "presentation": {
    "note_override": {
      "text": "《后坐力？什么后坐力？》：共享：",
      "scope": "all",
      "source_ref": "docs/archive/generated/route-atlas/workbench-routes.json",
      "reason": "机械迁移：当前正式workbench中只有一条可明确归属该任务的备注，按原文无损保存。"
    }
  }
}
