{
  "schema_version": 1,
  "task_id": 13010,
  "identity": {
    "name_zhcn": "科洛米尔，风暴之锤",
    "name_en": "Krolmir, Hammer of Storms",
    "game_variant_id": "timewalking-wotlk-cn",
    "version_scope": "TitanReforged-Wotlk-ChinaRegion 3.80.2 / 时光服",
    "faction": "both",
    "repeatability": "once"
  },
  "coverage": {
    "availability": "verified",
    "rewards": "verified",
    "guide": "partial"
  },
  "availability": {
    "quest_level": 80,
    "min_level": 77,
    "pre_any": [
      13051
    ],
    "pre_all": [],
    "parent_active": [],
    "exclusive_with": [],
    "required_reputation": null,
    "required_class": [],
    "required_race": [],
    "required_skill": [],
    "hidden_requirements": []
  },
  "rewards": {
    "reward_money_copper": 148000,
    "fixed_items": [],
    "choice_items_desc_by_sell": [
      {
        "item_id": 42793,
        "quantity": 1,
        "name_zhcn": "雪羽坠链",
        "name_en": "Locket of Snowcrest",
        "sell_price_each_copper": 39056,
        "sell_price_total_copper": 39056
      },
      {
        "item_id": 42835,
        "quantity": 1,
        "name_zhcn": "反向手套",
        "name_en": "Backhanded Grips",
        "sell_price_each_copper": 37856,
        "sell_price_total_copper": 37856
      },
      {
        "item_id": 42818,
        "quantity": 1,
        "name_zhcn": "风暴猎手腰带",
        "name_en": "Stormstalker's Clutch",
        "sell_price_each_copper": 32625,
        "sell_price_total_copper": 32625
      },
      {
        "item_id": 42806,
        "quantity": 1,
        "name_zhcn": "风暴侵蚀护腕",
        "name_en": "Storm-weathered Cuffs",
        "sell_price_each_copper": 27980,
        "sell_price_total_copper": 27980
      }
    ],
    "fixed_items_sell_total_copper": 0,
    "choice_item_max_sell_copper": 39056,
    "gear_sale_max_copper": 39056,
    "reputation_rewards": [
      {
        "faction_id": 1119,
        "amount": 350
      }
    ],
    "no_money_from_xp": false,
    "full_xp": 27550
  },
  "guide": [
    "接取：托里姆。",
    "托里姆要你与丹尼芬雷的约库姆国王谈一谈，向他打听科洛米尔的消息。",
    "交付：托里姆。"
  ],
  "fivebox": {
    "status": "not_shared"
  },
  "timing_rule_ref": "fixed-object-interaction",
  "evidence": [
    {
      "evidence_id": "evidence-questie-11.34.0",
      "source_type": "questie",
      "source_ref": "Questie 11.34.0 sha256=3c31d28a9c18189f3e245cdfb5b806210612e66da91c3661757c363724957861; effective quest row task_id=13010",
      "observed_at": null,
      "version_scope": "Questie WotLK 11.34.0",
      "confidence": "verified",
      "supports_fields": [
        "identity",
        "availability",
        "guide"
      ]
    },
    {
      "evidence_id": "evidence-rewards-azerothcore",
      "source_type": "local_db",
      "source_ref": "azerothcore/azerothcore-wotlk quest_template sha256=5dc7e6c92ea6875a5fc68cf5d3e33150e86cda5819a11af0c59217b24c63a37f; item_template sha256=bd4859be01946ca1521f7896f558f665e1e1d98890757a3df30e717b62768cc6 + Questie 11.34.0 zhCN/xp/reputation",
      "observed_at": null,
      "version_scope": "WotLK 3.3.5 base DB; Questie 11.34.0",
      "confidence": "verified",
      "supports_fields": [
        "rewards"
      ]
    },
    {
      "evidence_id": "user-live-2026-10-17-fivebox",
      "source_type": "user_live",
      "source_ref": "2026-10-17 Storm Peaks second DK fivebox live run: 《科洛米尔，风暴之锤》五号依次交互，按not_shared归类。",
      "observed_at": "2026-10-17",
      "version_scope": "TitanReforged-Wotlk-ChinaRegion 3.80.2 / 时光服",
      "confidence": "verified",
      "supports_fields": [
        "fivebox.status"
      ]
    }
  ],
  "presentation": {
    "note_override": {
      "text": "《科洛米尔，风暴之锤》：按约库姆对话/脚本完成科洛米尔事件。",
      "scope": "all",
      "source_ref": "docs/archive/generated/route-atlas/workbench-routes.json",
      "reason": "机械迁移：当前正式workbench中只有一条可明确归属该任务的备注，按原文无损保存。"
    }
  }
}
