{
  "schema_version": 1,
  "task_id": 9842,
  "identity": {
    "name_zhcn": "最锋利的刀刃",
    "name_en": "The Sharpest Blades",
    "game_variant_id": "timewalking-wotlk-cn",
    "version_scope": "TitanReforged-Wotlk-ChinaRegion 3.80.2 / 时光服",
    "faction": "both",
    "repeatability": "once"
  },
  "coverage": {
    "availability": "verified",
    "rewards": "verified",
    "guide": "partial"
  },
  "availability": {
    "quest_level": 64,
    "min_level": 62,
    "pre_any": [
      9841
    ],
    "pre_all": [],
    "parent_active": [],
    "exclusive_with": [],
    "required_reputation": null,
    "required_class": [],
    "required_race": [],
    "required_skill": [],
    "hidden_requirements": []
  },
  "rewards": {
    "reward_money_copper": 31000,
    "fixed_items": [],
    "choice_items_desc_by_sell": [
      {
        "item_id": 27756,
        "quantity": 1,
        "name_zhcn": "沼牙利斧",
        "name_en": "Marshfang Blade Axe",
        "sell_price_each_copper": 60895,
        "sell_price_total_copper": 60895
      },
      {
        "item_id": 27754,
        "quantity": 1,
        "name_zhcn": "锋利的沼牙切刀",
        "name_en": "Keen Marshfang Slicer",
        "sell_price_each_copper": 60447,
        "sell_price_total_copper": 60447
      },
      {
        "item_id": 27753,
        "quantity": 1,
        "name_zhcn": "沼牙魔剑",
        "name_en": "Ensorcelled Marshfang Blade",
        "sell_price_each_copper": 60223,
        "sell_price_total_copper": 60223
      }
    ],
    "fixed_items_sell_total_copper": 0,
    "choice_item_max_sell_copper": 60895,
    "gear_sale_max_copper": 60895,
    "reputation_rewards": [
      {
        "faction_id": 530,
        "amount": 250
      }
    ],
    "no_money_from_xp": false,
    "full_xp": 10750
  },
  "guide": [
    "接取：加巴林卡。",
    "将10柄沼牙切割者之刃交给萨布拉金的加巴林卡。",
    "交付：加巴林卡。"
  ],
  "fivebox": {
    "status": "pending"
  },
  "timing_rule_ref": null,
  "evidence": [
    {
      "evidence_id": "evidence-questie-11.34.0",
      "source_type": "questie",
      "source_ref": "Questie 11.34.0 sha256=3c31d28a9c18189f3e245cdfb5b806210612e66da91c3661757c363724957861; effective quest row task_id=9842",
      "observed_at": null,
      "version_scope": "Questie WotLK 11.34.0",
      "confidence": "verified",
      "supports_fields": [
        "identity",
        "availability",
        "guide"
      ]
    },
    {
      "evidence_id": "evidence-rewards-azerothcore",
      "source_type": "local_db",
      "source_ref": "azerothcore/azerothcore-wotlk quest_template sha256=5dc7e6c92ea6875a5fc68cf5d3e33150e86cda5819a11af0c59217b24c63a37f; item_template sha256=bd4859be01946ca1521f7896f558f665e1e1d98890757a3df30e717b62768cc6 + Questie 11.34.0 zhCN/xp/reputation",
      "observed_at": null,
      "version_scope": "WotLK 3.3.5 base DB; Questie 11.34.0",
      "confidence": "verified",
      "supports_fields": [
        "rewards"
      ]
    }
  ],
  "presentation": {
    "note_override": {
      "text": "",
      "scope": "all",
      "source_ref": "docs/archive/generated/route-atlas/workbench-routes.json",
      "reason": "机械迁移确认当前正式workbench没有可归属到该任务的独立备注；显式保持为空。"
    }
  }
}
