{
  "schema_version": 1,
  "task_id": 10813,
  "identity": {
    "name_zhcn": "格里洛克之眼",
    "name_en": "The Eyes of Grillok",
    "game_variant_id": "timewalking-wotlk-cn",
    "version_scope": "TitanReforged-Wotlk-ChinaRegion 3.80.2 / 时光服",
    "faction": "horde",
    "repeatability": "once"
  },
  "coverage": {
    "availability": "verified",
    "rewards": "verified",
    "guide": "partial"
  },
  "availability": {
    "quest_level": 62,
    "min_level": 58,
    "pre_any": [
      10809
    ],
    "pre_all": [],
    "parent_active": [],
    "exclusive_with": [],
    "required_reputation": null,
    "required_class": [],
    "required_race": [
      "orc",
      "undead",
      "tauren",
      "troll",
      "blood_elf"
    ],
    "required_skill": [],
    "hidden_requirements": []
  },
  "rewards": {
    "reward_money_copper": 14000,
    "fixed_items": [],
    "choice_items_desc_by_sell": [],
    "fixed_items_sell_total_copper": 0,
    "choice_item_max_sell_copper": 0,
    "gear_sale_max_copper": 0,
    "reputation_rewards": [
      {
        "faction_id": 947,
        "amount": 75
      }
    ],
    "no_money_from_xp": false,
    "full_xp": 5000
  },
  "guide": [
    "向塞萨克取得碎片捕获格里洛克之眼，再带到塞萨克的熔锅使其分离。",
    "当前按不共享执行：五号分别捕获眼睛，并分别在塞萨克的熔锅完成分离。已知眼睛刷新约45秒。"
  ],
  "fivebox": {
    "status": "not_shared"
  },
  "timing_rule_ref": "fixed-service-seconds",
  "evidence": [
    {
      "evidence_id": "evidence-foundation-migration",
      "source_type": "legacy_migration",
      "source_ref": "data/routes/world-candidate-dk/3483-hellfire-peninsula/route.json#quest_id=10813",
      "observed_at": null,
      "version_scope": "current migrated project data",
      "confidence": "partial",
      "supports_fields": [
        "identity.name_zhcn",
        "identity.name_en",
        "availability.quest_level",
        "availability.min_level",
        "availability.pre_any",
        "availability.pre_all"
      ]
    },
    {
      "evidence_id": "evidence-fivebox-migration",
      "source_type": "user_live",
      "source_ref": "data/observations/fivebox-task-types.json#tasks.10813",
      "observed_at": null,
      "version_scope": "TitanReforged-Wotlk-ChinaRegion 3.80.2 / 时光服",
      "confidence": "partial",
      "supports_fields": [
        "guide",
        "fivebox.status"
      ]
    },
    {
      "evidence_id": "evidence-questie-11.34.0",
      "source_type": "questie",
      "source_ref": "Questie 11.34.0 sha256=3c31d28a9c18189f3e245cdfb5b806210612e66da91c3661757c363724957861; effective quest row task_id=10813",
      "observed_at": null,
      "version_scope": "Questie WotLK 11.34.0",
      "confidence": "verified",
      "supports_fields": [
        "identity",
        "availability"
      ]
    },
    {
      "evidence_id": "evidence-rewards-azerothcore",
      "source_type": "local_db",
      "source_ref": "azerothcore/azerothcore-wotlk quest_template sha256=5dc7e6c92ea6875a5fc68cf5d3e33150e86cda5819a11af0c59217b24c63a37f; item_template sha256=bd4859be01946ca1521f7896f558f665e1e1d98890757a3df30e717b62768cc6 + Questie 11.34.0 zhCN/xp/reputation",
      "observed_at": null,
      "version_scope": "WotLK 3.3.5 base DB; Questie 11.34.0",
      "confidence": "verified",
      "supports_fields": [
        "rewards"
      ]
    },
    {
      "evidence_id": "evidence-fivebox-type-mapping",
      "source_type": "user_live",
      "source_ref": "data/observations/fivebox-task-types.json#tasks.10813; legacy_type=special_capture_mechanic_group_share_pending",
      "observed_at": "2026-09-15",
      "version_scope": "TitanReforged-Wotlk-ChinaRegion 3.80.2 / 时光服",
      "confidence": "partial",
      "supports_fields": [
        "fivebox.status"
      ]
    }
  ],
  "presentation": {
    "note_override": {
      "text": "《格里洛克之眼》：使用塞萨克的碎片捕获眼睛，再带到塞萨克的熔锅使其分离。",
      "scope": "all",
      "source_ref": "docs/archive/generated/route-atlas/workbench-routes.json",
      "reason": "机械迁移：当前正式workbench中只有一条可明确归属该任务的备注，按原文无损保存。"
    }
  }
}
