{
  "schema_version": 1,
  "task_id": 10123,
  "identity": {
    "name_zhcn": "魔火峡谷",
    "name_en": "Felspark Ravine",
    "game_variant_id": "timewalking-wotlk-cn",
    "version_scope": "TitanReforged-Wotlk-ChinaRegion 3.80.2 / 时光服",
    "faction": "horde",
    "repeatability": "once"
  },
  "coverage": {
    "availability": "verified",
    "rewards": "verified",
    "guide": "partial"
  },
  "availability": {
    "quest_level": 61,
    "min_level": 58,
    "pre_any": [
      10121
    ],
    "pre_all": [],
    "parent_active": [],
    "exclusive_with": [],
    "required_reputation": null,
    "required_class": [],
    "required_race": [
      "orc",
      "undead",
      "tauren",
      "troll",
      "blood_elf"
    ],
    "required_skill": [],
    "hidden_requirements": []
  },
  "rewards": {
    "reward_money_copper": 0,
    "fixed_items": [],
    "choice_items_desc_by_sell": [
      {
        "item_id": 29911,
        "quantity": 1,
        "name_zhcn": "阿迦玛甘之鬃",
        "name_en": "Agamaggan's Quill",
        "sell_price_each_copper": 64414,
        "sell_price_total_copper": 64414
      },
      {
        "item_id": 29910,
        "quantity": 1,
        "name_zhcn": "双界法杖",
        "name_en": "The Staff of Twin Worlds",
        "sell_price_each_copper": 64172,
        "sell_price_total_copper": 64172
      },
      {
        "item_id": 29908,
        "quantity": 1,
        "name_zhcn": "愤怒掠夺者",
        "name_en": "Rage Reaver",
        "sell_price_each_copper": 63676,
        "sell_price_total_copper": 63676
      },
      {
        "item_id": 29913,
        "quantity": 1,
        "name_zhcn": "斩敌剑",
        "name_en": "Foe Reaver",
        "sell_price_each_copper": 53349,
        "sell_price_total_copper": 53349
      },
      {
        "item_id": 29909,
        "quantity": 1,
        "name_zhcn": "尖啸匕首",
        "name_en": "Screaming Dagger",
        "sell_price_each_copper": 51139,
        "sell_price_total_copper": 51139
      }
    ],
    "fixed_items_sell_total_copper": 0,
    "choice_item_max_sell_copper": 64414,
    "gear_sale_max_copper": 64414,
    "reputation_rewards": [
      {
        "faction_id": 947,
        "amount": 250
      }
    ],
    "no_money_from_xp": false,
    "full_xp": 9800
  },
  "guide": [
    "接取：斯古尔·碎颅者中士。",
    "萨尔玛东侧补给车队的斯古尔·碎颅者中士要求你杀死4个唤火小鬼、6个地狱火战争使者和1个恐惧召唤者。",
    "交付：斯古尔·碎颅者中士。"
  ],
  "fivebox": {
    "status": "shared"
  },
  "timing_rule_ref": "shared-kill-count",
  "evidence": [
    {
      "evidence_id": "evidence-foundation-migration",
      "source_type": "legacy_migration",
      "source_ref": "data/routes/world-candidate-dk/3483-hellfire-peninsula/route.json#quest_id=10123",
      "observed_at": null,
      "version_scope": "current migrated project data",
      "confidence": "partial",
      "supports_fields": [
        "identity.name_zhcn",
        "identity.name_en",
        "availability.quest_level",
        "availability.min_level",
        "availability.pre_any",
        "availability.pre_all"
      ]
    },
    {
      "evidence_id": "evidence-questie-11.34.0",
      "source_type": "questie",
      "source_ref": "Questie 11.34.0 sha256=3c31d28a9c18189f3e245cdfb5b806210612e66da91c3661757c363724957861; effective quest row task_id=10123",
      "observed_at": null,
      "version_scope": "Questie WotLK 11.34.0",
      "confidence": "verified",
      "supports_fields": [
        "identity",
        "availability",
        "guide"
      ]
    },
    {
      "evidence_id": "evidence-rewards-azerothcore",
      "source_type": "local_db",
      "source_ref": "azerothcore/azerothcore-wotlk quest_template sha256=5dc7e6c92ea6875a5fc68cf5d3e33150e86cda5819a11af0c59217b24c63a37f; item_template sha256=bd4859be01946ca1521f7896f558f665e1e1d98890757a3df30e717b62768cc6 + Questie 11.34.0 zhCN/xp/reputation",
      "observed_at": null,
      "version_scope": "WotLK 3.3.5 base DB; Questie 11.34.0",
      "confidence": "verified",
      "supports_fields": [
        "rewards"
      ]
    },
    {
      "evidence_id": "evidence-derived-batch-audit-2026-09-26",
      "source_type": "derived",
      "source_ref": "2026-09-26 remaining-pending audit: ordinary kill-only objective with no personal stage.",
      "observed_at": "2026-09-26",
      "version_scope": "TitanReforged-Wotlk-ChinaRegion 3.80.2 / 时光服",
      "confidence": "verified",
      "supports_fields": [
        "fivebox"
      ]
    }
  ],
  "presentation": {
    "note_override": {
      "text": "",
      "scope": "all",
      "source_ref": "docs/archive/generated/route-atlas/workbench-routes.json",
      "reason": "机械迁移确认当前正式workbench没有可归属到该任务的独立备注；显式保持为空。"
    }
  }
}
